{
  "inventory_version": "1.0",
  "generated_from": {
    "commit": "6184d89",
    "recorded_at": "2026-09-18"
  },
  "milestones": [
    {
      "id": "M0",
      "title": "Foundations",
      "status": "complete",
      "closed_issue_count": 10,
      "total_issue_count": 10,
      "chainlink_milestone_id": 1
    },
    {
      "id": "M1",
      "title": "Prototype A",
      "status": "complete",
      "closed_issue_count": 1,
      "total_issue_count": 1,
      "chainlink_milestone_id": 2
    },
    {
      "id": "M2",
      "title": "Ship-early value track",
      "status": "complete",
      "closed_issue_count": 1,
      "total_issue_count": 1,
      "chainlink_milestone_id": 3
    },
    {
      "id": "M3",
      "title": "I-schema closure",
      "status": "complete",
      "closed_issue_count": 7,
      "total_issue_count": 7,
      "chainlink_milestone_id": 4
    },
    {
      "id": "M4",
      "title": "Bridge & release closure",
      "status": "complete",
      "closed_issue_count": 6,
      "total_issue_count": 6,
      "chainlink_milestone_id": 5
    }
  ],
  "gates": [
    {
      "gate_id": "G1a",
      "title": "Schema validation",
      "stage": "Stage 4 (every artifact type)",
      "implemented": true,
      "module": "scripts/validate_*.py (every validator, chainlink #9)",
      "cli_command": null
    },
    {
      "gate_id": "G1b",
      "title": "Repo-semantics / naming-and-layout validation",
      "stage": "Stage 4 (every artifact type)",
      "implemented": true,
      "module": "scripts/validate_*.py (every validator, chainlink #9)",
      "cli_command": null
    },
    {
      "gate_id": "G2+",
      "title": "Role safety (boundary contracts)",
      "stage": "Stage 4",
      "implemented": true,
      "module": "scripts/validate_boundary_contracts.py",
      "cli_command": "validate"
    },
    {
      "gate_id": "G2++",
      "title": "Boundary-required interaction role cross-check",
      "stage": "Stage 4",
      "implemented": true,
      "module": "scripts/validate_interaction.py",
      "cli_command": "validate-interaction"
    },
    {
      "gate_id": "G2 (bridge)",
      "title": "Bridge boundary-role cross-check",
      "stage": "Stage 4",
      "implemented": true,
      "module": "scripts/validate_bridge.py",
      "cli_command": "validate-bridge"
    },
    {
      "gate_id": "G2 (witness)",
      "title": "Witness query-adequacy cross-check",
      "stage": "Stage 4",
      "implemented": true,
      "module": "scripts/validate_witness.py",
      "cli_command": "validate-witness"
    },
    {
      "gate_id": "G9",
      "title": "Bridge-check identity verification against a recompiled harness",
      "stage": "Stage 8A",
      "implemented": true,
      "module": "scripts/gate_g9.py",
      "cli_command": "gate-g9"
    },
    {
      "gate_id": "G11",
      "title": "Unresolved evidence conflicts block",
      "stage": "Stage 4 (workspace-level)",
      "implemented": true,
      "module": "scripts/validate_conflict_resolution.py",
      "cli_command": "validate-conflict-resolution"
    },
    {
      "gate_id": "G14",
      "title": "Transitive assurance closure per cluster",
      "stage": "Stage 8C",
      "implemented": true,
      "module": "scripts/gate_g14.py",
      "cli_command": "gate-g14"
    },
    {
      "gate_id": "G15",
      "title": "Protocol coverage (non-pairwise needs debt or bridge)",
      "stage": "Stage 4",
      "implemented": true,
      "module": "scripts/validate_interaction.py",
      "cli_command": "validate-interaction"
    },
    {
      "gate_id": "G16",
      "title": "Risk-tiered unresolved-call policy",
      "stage": "Stage 8A",
      "implemented": true,
      "module": "scripts/gate_r1_g16.py",
      "cli_command": "gate-r1-g16"
    },
    {
      "gate_id": "G17",
      "title": "Closure-profile / degradation-record consistency",
      "stage": "Stage 8C",
      "implemented": true,
      "module": "scripts/validate_closure.py",
      "cli_command": "validate-closure"
    },
    {
      "gate_id": "G18",
      "title": "Witness coverage over declared witness_required features",
      "stage": "Stage 4",
      "implemented": true,
      "module": "scripts/gate_g18.py",
      "cli_command": "gate-g18"
    },
    {
      "gate_id": "G19",
      "title": "Witness determinism (value_hash regeneration)",
      "stage": "Stage 8A/CI",
      "implemented": true,
      "module": "scripts/gate_g19.py",
      "cli_command": "gate-g19"
    },
    {
      "gate_id": "G20",
      "title": "Witness degeneracy (must-vary vs constant)",
      "stage": "Stage 4.5",
      "implemented": true,
      "module": "scripts/gate_g20.py",
      "cli_command": "gate-g20"
    },
    {
      "gate_id": "R1",
      "title": "C_static-to-I reconciliation",
      "stage": "Stage 8A",
      "implemented": true,
      "module": "scripts/gate_r1_g16.py",
      "cli_command": "gate-r1-g16"
    },
    {
      "gate_id": "R2",
      "title": "Eligible-interaction coverage by boundary or reviewed exemption",
      "stage": "Stage 4",
      "implemented": true,
      "module": "scripts/validate_interaction.py",
      "cli_command": "validate-interaction"
    },
    {
      "gate_id": "CG3",
      "title": "Generic-callee type universality (recomputed from closure evidence when those records determine it; tracked capability gap when they do not)",
      "stage": "Stage 8C",
      "implemented": true,
      "module": "scripts/gate_g14.py (generic_callees_verification: verified from artifact data when no closure record is a Kani result and every work package is recorded, otherwise a CG3 gap that blocks without a degradation record naming it plus a tracking issue)",
      "cli_command": "gate-g14"
    },
    {
      "gate_id": "CG6",
      "title": "SCC well-foundedness discharge",
      "stage": "Stage 8C",
      "implemented": true,
      "module": "scripts/gate_g14.py",
      "cli_command": "gate-g14"
    },
    {
      "gate_id": "G21",
      "title": "Assumption-registry reference integrity (missing/ambiguous/hash-disagreeing/dangling)",
      "stage": "Stage 4 (workspace-level)",
      "implemented": true,
      "module": "scripts/assumption_registry.py",
      "cli_command": "validate"
    }
  ],
  "cli_commands": [
    {
      "name": "validate",
      "func": "cmd_validate",
      "stable_mapping": "validate boundary"
    },
    {
      "name": "validate-interaction",
      "func": "cmd_validate_interaction",
      "stable_mapping": "validate interaction"
    },
    {
      "name": "validate-exemption",
      "func": "cmd_validate_exemption",
      "stable_mapping": "validate exemption"
    },
    {
      "name": "validate-protocol-debt",
      "func": "cmd_validate_protocol_debt",
      "stable_mapping": "validate protocol-debt"
    },
    {
      "name": "validate-bridge",
      "func": "cmd_validate_bridge",
      "stable_mapping": "validate bridge"
    },
    {
      "name": "validate-evidence",
      "func": "cmd_validate_evidence",
      "stable_mapping": "validate evidence"
    },
    {
      "name": "validate-conflict-resolution",
      "func": "cmd_validate_conflict_resolution",
      "stable_mapping": "validate conflict-resolution"
    },
    {
      "name": "validate-work-package",
      "func": "cmd_validate_work_package",
      "stable_mapping": "validate work-package"
    },
    {
      "name": "validate-promotion",
      "func": "cmd_validate_promotion",
      "stable_mapping": "validate promotion"
    },
    {
      "name": "accept-promotion",
      "func": "cmd_accept_promotion",
      "stable_mapping": "approve promotion"
    },
    {
      "name": "accept-policy",
      "func": "cmd_accept_policy",
      "stable_mapping": "stable accept path for reviewed normative-policy drift -- records the on-disk reliance-policy document as the manifest's reviewed base_hash, and with --version stamps that document's single `Policy version:` marker line first so the template `init` installs can reach an accepted state without a hand-edit of a protected_root (chainlink #78, #113, docs/cli-contract.md \u00a78)"
    },
    {
      "name": "promote-evidence",
      "func": "cmd_promote_evidence",
      "stable_mapping": "stable mechanical evidence-draft promotion -- re-validates a staged evidence/*.json.draft (G1a/G1b), renames it to its target, and records the move (chainlink #79, docs/cli-contract.md \u00a71/\u00a710)"
    },
    {
      "name": "record-ruling",
      "func": "cmd_record_ruling",
      "stable_mapping": "stable human-ruling record over an exact artifact set -- the gate accept-promotion enforces before minting a receipt (chainlink #82, docs/cli-contract.md \u00a71/\u00a75/\u00a710)"
    },
    {
      "name": "record-assurance",
      "func": "cmd_record_assurance",
      "stable_mapping": "stable assurance-recording command -- assembles a work package's assurance report at its manifest's own report.emit path from why3find proof certificates, with only the obligation-to-certificate mapping declared by the caller and that declaration checked (chainlink #87, docs/cli-contract.md \u00a71/\u00a710)"
    },
    {
      "name": "draft",
      "func": "cmd_draft",
      "stable_mapping": "draft <artifact-kind> (already nested: stage/template_name are its own arguments)"
    },
    {
      "name": "approve",
      "func": "cmd_approve",
      "stable_mapping": "approve draft"
    },
    {
      "name": "approve-pair",
      "func": "cmd_approve_pair",
      "stable_mapping": "approve pair"
    },
    {
      "name": "approve-exemption-pair",
      "func": "cmd_approve_exemption_pair",
      "stable_mapping": "approve exemption-pair"
    },
    {
      "name": "extract-c-static",
      "func": "cmd_extract_c_static",
      "stable_mapping": "internal operation invoked by check (Stage 8A data refresh feeding gate r1-g16)"
    },
    {
      "name": "validate-callsites",
      "func": "cmd_validate_callsites",